{
  "schema": "passdown.claim/v1",
  "key": "repo",
  "holder": "pd-20260928T162825Z-654f6346",
  "store": "/fixture/.git/passdown/attempts",
  "profile": null,
  "location": "/fixture",
  "acquired_at": "2026-09-28T16:28:25Z",
  "history": [],
  "released_at": "2026-09-28T16:44:05Z",
  "release_basis": "attested:user (executor never launched; no output produced; creating fresh attempt)"
}
